"Spotify-This-Song","Song Name: The Real Slim Shady","Preview URL: null","Album Name: The Marshall Mathers LP","Artist Name: Eminem",
"Spotify-This-Song","Song Name: 'Till I Collapse","Preview URL: null","Album Name: The Eminem Show (Explicit Version)","Artist Name: Eminem",
"Movie-This","Title: Mr. Nobody","Year: 2009","Rating: 7.9/10","Rotten Tomatoes Rating: 64%","Country: Belgium, Germany, Canada, France, USA, UK","Languages: English, Mohawk","Plot: A boy stands on a station platform as a train is about to leave. Should he go with his mother or stay with his father? Infinite possibilities arise from this decision. As long as he doesn't choose, anything is possible.","Actors: Jared Leto, Sarah Polley, Diane Kruger, Linh Dan Pham",
"Movie-This","Title: Ace Ventura: Pet Detective","Year: 1994","Rating: 6.9/10","Rotten Tomatoes Rating: 46%","Country: USA","Languages: English","Plot: A goofy detective specializing in animals goes in search of the missing mascot of the Miami Dolphins.","Actors: Jim Carrey, Courteney Cox, Sean Young, Tone Loc",
"My-Tweets","Tweet: Hi Twitter! Check out all my apps!","Date: Sun, Aug 20, 2017 at 01:59:25","Tweet: Hey Twitter https://t.co/qT6T5DKZ6G - Check out My Git Hub #github #coding #Developer","Date: Sun, Aug 20, 2017 at 02:00:04","Tweet: hello twitter @medamanUCI","Date: Sat, Aug 26, 2017 at 19:11:47","Tweet: tweet tweet tweet #tweet","Date: Sat, Aug 26, 2017 at 19:11:59","Tweet: tweeting is awesome.","Date: Sat, Aug 26, 2017 at 19:12:13","Tweet: hey everybody!","Date: Sat, Aug 26, 2017 at 19:12:22","Tweet: a","Date: Sat, Aug 26, 2017 at 19:14:14","Tweet: b","Date: Sat, Aug 26, 2017 at 19:14:17","Tweet: c","Date: Sat, Aug 26, 2017 at 19:14:20","Tweet: d","Date: Sat, Aug 26, 2017 at 19:14:24","Tweet: e","Date: Sat, Aug 26, 2017 at 19:14:29","Tweet: f","Date: Sat, Aug 26, 2017 at 19:14:32","Tweet: g","Date: Sat, Aug 26, 2017 at 19:14:35","Tweet: h","Date: Sat, Aug 26, 2017 at 19:14:38","Tweet: i","Date: Sat, Aug 26, 2017 at 19:14:42","Tweet: j","Date: Sat, Aug 26, 2017 at 19:14:51","Tweet: k","Date: Sat, Aug 26, 2017 at 19:14:56","Tweet: l","Date: Sat, Aug 26, 2017 at 19:14:58","Tweet: :-)","Date: Sat, Aug 26, 2017 at 19:17:32","Tweet: 😀😀😀😀","Date: Sat, Aug 26, 2017 at 19:17:43",
"Spotify-This-Song","Song Name: The Sign","Preview URL: https://p.scdn.co/mp3-preview/4c463359f67dd3546db7294d236dd0ae991882ff?cid=c5da9fa2455149d2a56c02fa5882cb03","Album Name: The Sign (US Album) [Remastered]","Artist Name: Ace of Base",
